output/compare_geo/geo_1_vs_geo_2.json

{
  "reference_file": "output\\centerline\\geo_1.json",
  "target_file": "output\\centerline\\geo_2.json",
  "reference_node_count": 18,
  "target_node_count": 18,
  "reference_segment_count": 18,
  "target_segment_count": 18,
  "matched_node_count": 18,
  "matched_segment_count": 18,
  "node_mapping": {
    "C0": "C0",
    "C1": "C1",
    "C2": "C2",
    "C3": "C3",
    "C4": "C4",
    "C5": "C5",
    "B6": "B6",
    "B7": "B7",
    "B8": "B8",
    "B9": "B9",
    "B10": "B10",
    "B11": "B11",
    "B12": "B12",
    "B13": "B13",
    "B14": "B14",
    "B15": "B15",
    "B16": "B16",
    "B17": "B17"
  },
  "segment_matches": [
    {
      "ref_segment": "S0",
      "target_segment": "S0",
      "ref_from_node": "B7",
      "ref_to_node": "C0",
      "target_from_node": "B7",
      "target_to_node": "C0",
      "rotation_deg": 0.359568,
      "translation_midpoint_xy": [
        -1.5,
        0.0
      ],
      "rigid_translation_xy": [
        -0.62686,
        -8.262302
      ],
      "length_ref": 139.671042,
      "length_target": 139.186925,
      "length_ratio": 0.996534,
      "midpoint_ref": [
        1317.0,
        135.0
      ],
      "midpoint_target": [
        1315.5,
        135.0
      ],
      "angle_ref_deg": 60.865708,
      "angle_target_deg": 61.225275
    },
    {
      "ref_segment": "S1",
      "target_segment": "S1",
      "ref_from_node": "C0",
      "ref_to_node": "B6",
      "target_from_node": "C0",
      "target_to_node": "B6",
      "rotation_deg": -0.047519,
      "translation_midpoint_xy": [
        -1.5,
        0.5
      ],
      "rigid_translation_xy": [
        -1.831655,
        1.714737
      ],
      "length_ref": 467.771312,
      "length_target": 469.131112,
      "length_ratio": 1.002907,
      "midpoint_ref": [
        1464.5,
        400.5
      ],
      "midpoint_target": [
        1463.0,
        401.0
      ],
      "angle_ref_deg": 60.96919,
      "angle_target_deg": 60.921671
    },
    {
      "ref_segment": "S10",
      "target_segment": "S10",
      "ref_from_node": "C0",
      "ref_to_node": "C1",
      "target_from_node": "C0",
      "target_to_node": "C1",
      "rotation_deg": -0.071051,
      "translation_midpoint_xy": [
        -1.0,
        -1.0
      ],
      "rigid_translation_xy": [
        -1.505634,
        0.508862
      ],
      "length_ref": 502.977137,
      "length_target": 500.217952,
      "length_ratio": 0.994514,
      "midpoint_ref": [
        1216.5,
        408.5
      ],
      "midpoint_target": [
        1215.5,
        407.5
      ],
      "angle_ref_deg": 122.331404,
      "angle_target_deg": 122.260353
    },
    {
      "ref_segment": "S11",
      "target_segment": "S11",
      "ref_from_node": "C1",
      "ref_to_node": "C3",
      "target_from_node": "C1",
      "target_to_node": "C3",
      "rotation_deg": 0.031635,
      "translation_midpoint_xy": [
        -0.5,
        -1.5
      ],
      "rigid_translation_xy": [
        -0.024472,
        -2.013905
      ],
      "length_ref": 567.101402,
      "length_target": 568.480431,
      "length_ratio": 1.002432,
      "midpoint_ref": [
        931.0,
        861.0
      ],
      "midpoint_target": [
        930.5,
        859.5
      ],
      "angle_ref_deg": 122.176735,
      "angle_target_deg": 122.208369
    },
    {
      "ref_segment": "S12",
      "target_segment": "S12",
      "ref_from_node": "C3",
      "ref_to_node": "B13",
      "target_from_node": "C3",
      "target_to_node": "B13",
      "rotation_deg": -0.060884,
      "translation_midpoint_xy": [
        -0.5,
        -0.5
      ],
      "rigid_translation_xy": [
        -2.252555,
        -0.038952
      ],
      "length_ref": 1298.092832,
      "length_target": 1298.40402,
      "length_ratio": 1.00024,
      "midpoint_ref": [
        433.0,
        1649.5
      ],
      "midpoint_target": [
        432.5,
        1649.0
      ],
      "angle_ref_deg": 122.318855,
      "angle_target_deg": 122.257971
    },
    {
      "ref_segment": "S13",
      "target_segment": "S13",
      "ref_from_node": "B15",
      "ref_to_node": "C2",
      "target_from_node": "B15",
      "target_to_node": "C2",
      "rotation_deg": -0.206099,
      "translation_midpoint_xy": [
        0.5,
        -0.5
      ],
      "rigid_translation_xy": [
        0.115152,
        2.524064
      ],
      "length_ref": 82.377181,
      "length_target": 80.993827,
      "length_ratio": 0.983207,
      "midpoint_ref": [
        840.5,
        108.5
      ],
      "midpoint_target": [
        841.0,
        108.0
      ],
      "angle_ref_deg": 123.111342,
      "angle_target_deg": 122.905243
    },
    {
      "ref_segment": "S14",
      "target_segment": "S14",
      "ref_from_node": "C2",
      "ref_to_node": "C4",
      "target_from_node": "C2",
      "target_to_node": "C4",
      "rotation_deg": 0.030397,
      "translation_midpoint_xy": [
        0.5,
        -0.5
      ],
      "rigid_translation_xy": [
        0.699571,
        -0.853807
      ],
      "length_ref": 555.30172,
      "length_target": 556.68483,
      "length_ratio": 1.002491,
      "midpoint_ref": [
        667.0,
        376.0
      ],
      "midpoint_target": [
        667.5,
        375.5
      ],
      "angle_ref_deg": 122.946008,
      "angle_target_deg": 122.976405
    },
    {
      "ref_segment": "S15",
      "target_segment": "S15",
      "ref_from_node": "C4",
      "ref_to_node": "B14",
      "target_from_node": "C4",
      "target_to_node": "B14",
      "rotation_deg": 0.019675,
      "translation_midpoint_xy": [
        -0.5,
        0.5
      ],
      "rigid_translation_xy": [
        -0.167584,
        0.402878
      ],
      "length_ref": 855.967289,
      "length_target": 857.35057,
      "length_ratio": 1.001616,
      "midpoint_ref": [
        283.0,
        968.0
      ],
      "midpoint_target": [
        282.5,
        968.5
      ],
      "angle_ref_deg": 122.984582,
      "angle_target_deg": 123.004256
    },
    {
      "ref_segment": "S16",
      "target_segment": "S16",
      "ref_from_node": "B17",
      "ref_to_node": "C5",
      "target_from_node": "B17",
      "target_to_node": "C5",
      "rotation_deg": -0.236244,
      "translation_midpoint_xy": [
        0.0,
        0.5
      ],
      "rigid_translation_xy": [
        -0.533232,
        1.853524
      ],
      "length_ref": 135.351395,
      "length_target": 136.180028,
      "length_ratio": 1.006122,
      "midpoint_ref": [
        328.0,
        130.0
      ],
      "midpoint_target": [
        328.0,
        130.5
      ],
      "angle_ref_deg": 124.159695,
      "angle_target_deg": 123.92345
    },
    {
      "ref_segment": "S17",
      "target_segment": "S17",
      "ref_from_node": "C5",
      "ref_to_node": "B16",
      "target_from_node": "C5",
      "target_to_node": "B16",
      "rotation_deg": -0.038344,
      "translation_midpoint_xy": [
        -0.5,
        2.0
      ],
      "rigid_translation_xy": [
        -0.743561,
        2.11385
      ],
      "length_ref": 429.343685,
      "length_target": 431.56112,
      "length_ratio": 1.005165,
      "midpoint_ref": [
        170.0,
        364.0
      ],
      "midpoint_target": [
        169.5,
        366.0
      ],
      "angle_ref_deg": 123.986167,
      "angle_target_deg": 123.947823
    },
    {
      "ref_segment": "S2",
      "target_segment": "S2",
      "ref_from_node": "B9",
      "ref_to_node": "C2",
      "target_from_node": "B9",
      "target_to_node": "C2",
      "rotation_deg": -0.354826,
      "translation_midpoint_xy": [
        1.0,
        -0.5
      ],
      "rigid_translation_xy": [
        0.343398,
        4.45016
      ],
      "length_ref": 78.771822,
      "length_target": 77.897368,
      "length_ratio": 0.988899,
      "midpoint_ref": [
        799.0,
        108.5
      ],
      "midpoint_target": [
        800.0,
        108.0
      ],
      "angle_ref_deg": 61.15734,
      "angle_target_deg": 60.802514
    },
    {
      "ref_segment": "S3",
      "target_segment": "S3",
      "ref_from_node": "C2",
      "ref_to_node": "C1",
      "target_from_node": "C2",
      "target_to_node": "C1",
      "rotation_deg": 0.041223,
      "translation_midpoint_xy": [
        0.5,
        -1.5
      ],
      "rigid_translation_xy": [
        0.775086,
        -2.183405
      ],
      "length_ref": 546.058605,
      "length_target": 544.699917,
      "length_ratio": 0.997512,
      "midpoint_ref": [
        950.0,
        382.0
      ],
      "midpoint_target": [
        950.5,
        380.5
      ],
      "angle_ref_deg": 61.088075,
      "angle_target_deg": 61.129298
    },
    {
      "ref_segment": "S4",
      "target_segment": "S4",
      "ref_from_node": "C1",
      "ref_to_node": "B8",
      "target_from_node": "C1",
      "target_to_node": "B8",
      "rotation_deg": -0.005129,
      "translation_midpoint_xy": [
        -0.5,
        -3.0
      ],
      "rigid_translation_xy": [
        -0.595773,
        -2.880944
      ],
      "length_ref": 1025.875236,
      "length_target": 1023.64105,
      "length_ratio": 0.997822,
      "midpoint_ref": [
        1330.0,
        1070.0
      ],
      "midpoint_target": [
        1329.5,
        1067.0
      ],
      "angle_ref_deg": 61.086438,
      "angle_target_deg": 61.081309
    },
    {
      "ref_segment": "S5",
      "target_segment": "S5",
      "ref_from_node": "B10",
      "ref_to_node": "C5",
      "target_from_node": "B10",
      "target_to_node": "C5",
      "rotation_deg": 0.211475,
      "translation_midpoint_xy": [
        0.0,
        0.5
      ],
      "rigid_translation_xy": [
        0.481591,
        -0.458754
      ],
      "length_ref": 127.059041,
      "length_target": 127.941393,
      "length_ratio": 1.006944,
      "midpoint_ref": [
        260.0,
        130.0
      ],
      "midpoint_target": [
        260.0,
        130.5
      ],
      "angle_ref_deg": 61.82141,
      "angle_target_deg": 62.032884
    },
    {
      "ref_segment": "S6",
      "target_segment": "S6",
      "ref_from_node": "C5",
      "ref_to_node": "C4",
      "target_from_node": "C5",
      "target_to_node": "C4",
      "rotation_deg": -0.056402,
      "translation_midpoint_xy": [
        0.0,
        0.5
      ],
      "rigid_translation_xy": [
        -0.391103,
        0.896905
      ],
      "length_ref": 479.588365,
      "length_target": 478.706591,
      "length_ratio": 0.998161,
      "midpoint_ref": [
        403.0,
        397.5
      ],
      "midpoint_target": [
        403.0,
        398.0
      ],
      "angle_ref_deg": 61.885348,
      "angle_target_deg": 61.828946
    },
    {
      "ref_segment": "S7",
      "target_segment": "S7",
      "ref_from_node": "C4",
      "ref_to_node": "C3",
      "target_from_node": "C4",
      "target_to_node": "C3",
      "rotation_deg": 0.042004,
      "translation_midpoint_xy": [
        -0.5,
        -0.5
      ],
      "rigid_translation_xy": [
        0.126983,
        -0.974825
      ],
      "length_ref": 558.354726,
      "length_target": 557.000898,
      "length_ratio": 0.997575,
      "midpoint_ref": [
        648.0,
        855.0
      ],
      "midpoint_target": [
        647.5,
        854.5
      ],
      "angle_ref_deg": 61.782644,
      "angle_target_deg": 61.824648
    },
    {
      "ref_segment": "S8",
      "target_segment": "S8",
      "ref_from_node": "C3",
      "ref_to_node": "B11",
      "target_from_node": "C3",
      "target_to_node": "B11",
      "rotation_deg": -0.018908,
      "translation_midpoint_xy": [
        -0.5,
        -0.5
      ],
      "rigid_translation_xy": [
        -1.044275,
        -0.145821
      ],
      "length_ref": 1243.706155,
      "length_target": 1245.059436,
      "length_ratio": 1.001088,
      "midpoint_ref": [
        1073.0,
        1649.5
      ],
      "midpoint_target": [
        1072.5,
        1649.0
      ],
      "angle_ref_deg": 61.889574,
      "angle_target_deg": 61.870667
    },
    {
      "ref_segment": "S9",
      "target_segment": "S9",
      "ref_from_node": "B12",
      "ref_to_node": "C0",
      "target_from_node": "B12",
      "target_to_node": "C0",
      "rotation_deg": 0.0,
      "translation_midpoint_xy": [
        -2.0,
        0.0
      ],
      "rigid_translation_xy": [
        -2.0,
        0.0
      ],
      "length_ref": 144.267113,
      "length_target": 144.267113,
      "length_ratio": 1.0,
      "midpoint_ref": [
        1389.5,
        135.0
      ],
      "midpoint_target": [
        1387.5,
        135.0
      ],
      "angle_ref_deg": 122.257971,
      "angle_target_deg": 122.257971
    }
  ]
}

output/compare_geo/bianxing.md

python -m src.patterns.compare_geo_segments --ref "./output/centerline/geo_1.json" --targets "./output/centerline/geo_2.json" "./output/centerline/geo_3.json"
[OK] geo_2.json
  matched_node_count    = 18
  matched_segment_count = 18
  json                  = output\compare_geo\geo_1_vs_geo_2.json
  image                 = output\compare_geo\geo_1_vs_geo_2_vis.png
    S0 -> S0   | rot=   0.3596 deg | mid_t=(   -1.50,     0.00) | len_ratio=0.9965
    S1 -> S1   | rot=  -0.0475 deg | mid_t=(   -1.50,     0.50) | len_ratio=1.0029
   S10 -> S10  | rot=  -0.0711 deg | mid_t=(   -1.00,    -1.00) | len_ratio=0.9945
   S11 -> S11  | rot=   0.0316 deg | mid_t=(   -0.50,    -1.50) | len_ratio=1.0024
   S12 -> S12  | rot=  -0.0609 deg | mid_t=(   -0.50,    -0.50) | len_ratio=1.0002
   S13 -> S13  | rot=  -0.2061 deg | mid_t=(    0.50,    -0.50) | len_ratio=0.9832
   S14 -> S14  | rot=   0.0304 deg | mid_t=(    0.50,    -0.50) | len_ratio=1.0025
   S15 -> S15  | rot=   0.0197 deg | mid_t=(   -0.50,     0.50) | len_ratio=1.0016
   S16 -> S16  | rot=  -0.2362 deg | mid_t=(    0.00,     0.50) | len_ratio=1.0061
   S17 -> S17  | rot=  -0.0383 deg | mid_t=(   -0.50,     2.00) | len_ratio=1.0052
    S2 -> S2   | rot=  -0.3548 deg | mid_t=(    1.00,    -0.50) | len_ratio=0.9889
    S3 -> S3   | rot=   0.0412 deg | mid_t=(    0.50,    -1.50) | len_ratio=0.9975
    S4 -> S4   | rot=  -0.0051 deg | mid_t=(   -0.50,    -3.00) | len_ratio=0.9978
    S5 -> S5   | rot=   0.2115 deg | mid_t=(    0.00,     0.50) | len_ratio=1.0069
    S6 -> S6   | rot=  -0.0564 deg | mid_t=(    0.00,     0.50) | len_ratio=0.9982
    S7 -> S7   | rot=   0.0420 deg | mid_t=(   -0.50,    -0.50) | len_ratio=0.9976
    S8 -> S8   | rot=  -0.0189 deg | mid_t=(   -0.50,    -0.50) | len_ratio=1.0011
    S9 -> S9   | rot=   0.0000 deg | mid_t=(   -2.00,     0.00) | len_ratio=1.0000